{
  "predicates": [
    {
      "description": "Categories and types of services in the financial scope. An entity can be tag with one or more categories or types of services.",
      "expanded": "Categories and types of services",
      "value": "categories-and-types-of-services",
      "uuid": "33d42180-32df-54c4-b85a-ac76e3c3b27e"
    },
    {
      "description": "Geographical footprint of the financial entity.",
      "expanded": "Geographical footprint",
      "value": "geographical-footprint",
      "uuid": "1d703f85-e44e-5bbc-b8e2-9fc6f3e564a7"
    },
    {
      "description": "Online exposition of the financial entity.",
      "expanded": "Online exposition",
      "value": "online-exposition",
      "uuid": "24cae7a9-e62b-5af9-b011-2d8f3e50be2a"
    },
    {
      "description": "Physical presence of the financial entity.",
      "expanded": "Physical presence",
      "value": "physical-presence",
      "uuid": "840e8b26-af26-589b-86d6-b7e2db6bcdd4"
    },
    {
      "description": "Services provided by the financial entity.",
      "expanded": "Services",
      "value": "services",
      "uuid": "41a4f778-6669-55fd-9e75-e1a7b402e77a"
    }
  ],
  "values": [
    {
      "predicate": "categories-and-types-of-services",
      "entry": [
        {
          "value": "banking",
          "expanded": "Banking",
          "description": "Financial entity described or/and regulated as banking.",
          "uuid": "807559a3-8230-559d-941e-d455c4ca0d59"
        },
        {
          "value": "private",
          "expanded": "Private",
          "description": "Financial entity engaged in private banking.",
          "uuid": "4dd4fcd3-fffd-5de6-8ab1-04c495acf4f4"
        },
        {
          "value": "retail",
          "expanded": "Retail",
          "description": "Financial entity engaged in retail banking.",
          "uuid": "1aa037a5-3b66-5b02-8b9b-7f79fe2c5f83"
        },
        {
          "value": "custodian-banking",
          "expanded": "Custodian banking",
          "description": "Financial entity having physical possessions of clients financial assets or instruments.",
          "uuid": "f287bc95-09dc-5da7-96ab-eb31392e6b28"
        },
        {
          "value": "financial-market-infrastructure",
          "expanded": "Financial market infrastructure",
          "description": "Financial market infrastructure such as stock exchange, CSD",
          "uuid": "b7ed8e62-2c2b-5327-aab8-774e4e8ddb2f"
        },
        {
          "value": "asset-management",
          "expanded": "Asset management",
          "description": "Financial entity managing financial assets on behalf of others.",
          "uuid": "036fc7be-f816-5817-aa6b-e6e99b7ce17b"
        },
        {
          "value": "it-provider",
          "expanded": "IT provider",
          "description": "IT provider supporting financial entities and regulated in the financial legal framework (such as support PFS in Luxembourg).",
          "uuid": "07a13b36-f9ab-599b-abde-016e356d9c5f"
        },
        {
          "value": "e-money-and-payment",
          "expanded": "e-money and payment",
          "description": "Financial entity managing electronic money as alternative to cash payment. (EU directive - Directive 2009/110/EC)",
          "uuid": "7c438638-3603-5bc9-82ed-764d9966a217"
        },
        {
          "value": "other",
          "expanded": "Other",
          "description": "Other entity classified as financial entity with other activities not defined in this taxonomy.",
          "uuid": "744ac459-e2fc-5cf2-8042-8229cd04ab8c"
        }
      ]
    },
    {
      "predicate": "geographical-footprint",
      "entry": [
        {
          "value": "client-coverage-local",
          "expanded": "Client coverage is local",
          "description": "Client and customer coverage is local to the financial entity (such as a country).",
          "uuid": "ce6c4a74-bcc4-5bef-aa7a-ec22a798888c"
        },
        {
          "value": "client-coverage-eu",
          "expanded": "Client coverage in EU",
          "description": "Client and customer coverage is limited to the European Union.",
          "uuid": "369fdd26-364c-5341-82bb-c5e4a1dd7679"
        },
        {
          "value": "client-coverage-worldwide",
          "expanded": "Client coverage is worldwide",
          "description": "Client and customer coverage is worldwide.",
          "uuid": "226de167-a846-56fb-998f-4c204f979774"
        },
        {
          "value": "corporate-structure-local",
          "expanded": "Corporate structure is local",
          "description": "Corporate structure is local to the financial entity (such as a country).",
          "uuid": "57e96e1f-7686-5b9f-9e41-cdc9b8537cb6"
        },
        {
          "value": "corporate-structure-eu",
          "expanded": "Corporate structure in EU",
          "description": "Corporate structure is located in the European Union.",
          "uuid": "55fc7082-2975-57a3-916a-58da5e16b386"
        },
        {
          "value": "corporate-structure-worldwide",
          "expanded": "Corporate structure is worldwide",
          "description": "Corporate structure is located worldwide.",
          "uuid": "90c58868-babf-5293-8bf9-b1750d5d833f"
        }
      ]
    },
    {
      "predicate": "online-exposition",
      "entry": [
        {
          "value": "limited",
          "expanded": "Limited",
          "description": "Online presence of the financial entity is limited such as just a public web server and/or email services.",
          "uuid": "381b1614-2827-5d35-9d13-eb134ff3ad02"
        },
        {
          "value": "extended",
          "expanded": "Extended",
          "description": "Online presence of the financial entity is extended with online services for the clients and customers but still with a physical presence.",
          "uuid": "e2ffbe9b-ba28-534a-8450-281f03d8bba9"
        },
        {
          "value": "crucial",
          "expanded": "Crucial",
          "description": "Online presence of the financial entity is crucial and business depends on online presence, extensive use of cloud computing, APIs, etc.",
          "uuid": "49a6b3fe-d4c2-50ff-a9d8-9573ab7455a7"
        }
      ]
    },
    {
      "predicate": "physical-presence",
      "entry": [
        {
          "value": "atm",
          "expanded": "Automated teller machines",
          "description": "The financial entity owns and/or operates automated teller machines (ATM).",
          "uuid": "bb88598e-48f5-5726-89d3-f4bbbe39cde6"
        },
        {
          "value": "pos",
          "expanded": "Point of sale terminals",
          "description": "The financial entity owns and/or operates point of sale terminals (POS).",
          "uuid": "2491e522-cc5e-5cd8-9d1f-07576007669b"
        }
      ]
    },
    {
      "predicate": "services",
      "entry": [
        {
          "value": "settlement",
          "expanded": "Settlement",
          "description": "A financial entity providing settlement services.",
          "uuid": "e20463d3-908d-50d7-bea7-400aef82717c"
        },
        {
          "value": "collateral-management",
          "expanded": "Collatoral management",
          "description": "A financial entity providing collateral management services.",
          "uuid": "88967c05-2af9-5a71-afc1-719fb0c00787"
        },
        {
          "value": "listing-operation-of-trading-platform",
          "expanded": "Listing and operation of trading platform",
          "description": "A financial entity providing listing and operation of trading platform.",
          "uuid": "f179ad2b-0b95-55bd-b915-1aec633fb8c2"
        },
        {
          "value": "credit-granting",
          "expanded": "Credit granting",
          "description": "A financial entity providing credit granting.",
          "uuid": "2cb6cc84-2870-52df-99a9-b2f525010913"
        },
        {
          "value": "deposit-management",
          "expanded": "Deposit management",
          "description": "A financial entity providing deposit management.",
          "uuid": "f6ce17f4-4a2f-50f5-8b80-b69934736af0"
        },
        {
          "value": "custodian-banking",
          "expanded": "Custodian banking",
          "description": "A financial entity providing custodian banking.",
          "uuid": "722421a8-19a6-5ffa-9c61-4fb93a4954c1"
        },
        {
          "value": "payment-services",
          "expanded": "Payment services",
          "description": "A financial entity providing payment services.",
          "uuid": "69e8eb7f-2ff1-54c4-94b9-46db0208c2b0"
        },
        {
          "value": "investment-services",
          "expanded": "Investment services",
          "description": "A financial entity providing investment services.",
          "uuid": "7bc64089-2c6c-5f74-b2e0-456a1ee37ec0"
        }
      ]
    }
  ],
  "version": 7,
  "description": "Financial taxonomy to describe financial services, infrastructure and financial scope.",
  "expanded": "Financial",
  "namespace": "financial",
  "uuid": "8b761314-6385-51bc-81e9-8030bb348d1a"
}
