{
  "namespace": "vulnerability",
  "expanded": "vulnerability",
  "description": "A taxonomy for describing vulnerabilities (software, hardware, or social) on different scales or with additional available information.",
  "version": 3,
  "predicates": [
    {
      "value": "sighting",
      "expanded": "Sighting",
      "description": "Sighting information related to the vulnerability.",
      "uuid": "7de57a84-5345-5bf3-8d06-92f6b8a7836a"
    },
    {
      "value": "exploitability",
      "expanded": "Exploitability",
      "description": "Quantification of attack exploitability, providing a level of exploitation for the identified vulnerability.",
      "exclusive": true,
      "uuid": "ee58b264-5030-5e82-a092-09bf2e883c5d"
    },
    {
      "value": "information",
      "expanded": "Information",
      "description": "Complementary information related to the vulnerability.",
      "uuid": "9704e9e9-5a94-51a2-ae1b-4bb9edbe4e0d"
    }
  ],
  "values": [
    {
      "predicate": "sighting",
      "entry": [
        {
          "value": "seen",
          "expanded": "Seen",
          "description": "The vulnerability was mentioned, discussed, or seen somewhere by the user.",
          "uuid": "1f91a1b6-bd7e-5922-b11c-7b9b9d2a9bcf"
        },
        {
          "value": "confirmed",
          "expanded": "Confirmed",
          "description": "The vulnerability is confirmed from an analyst perspective.",
          "uuid": "ffe81c1b-c31e-59a2-8d6d-6cc22c517255"
        },
        {
          "value": "exploited",
          "expanded": "Exploited",
          "description": "This vulnerability was exploited and seen by the user reporting the sighting.",
          "uuid": "2fb7da28-aeb5-5f26-bcaf-b24fe80d386e"
        },
        {
          "value": "patched",
          "expanded": "Patched",
          "description": "This vulnerability was successfully patched by the user reporting the sighting.",
          "uuid": "d610dcf2-7b0a-5d4b-82e9-4601a6ea7f1b"
        },
        {
          "value": "not-exploited",
          "expanded": "Not exploited",
          "description": "This vulnerability was not exploited or seen by the user reporting the sighting.",
          "uuid": "27188462-f6b7-52c4-9918-615b9e29adc6"
        },
        {
          "value": "not-confirmed",
          "expanded": "Not confirmed",
          "description": "The user expresses doubt about the veracity of the vulnerability.",
          "uuid": "d69960df-db59-5d1b-98d2-ff37761f01a3"
        },
        {
          "value": "not-patched",
          "expanded": "Not patched",
          "description": "This vulnerability was not successfully patched by the user reporting the sighting.",
          "uuid": "29b5512c-8a55-5ca8-93ba-567a6ab30e12"
        }
      ]
    },
    {
      "predicate": "exploitability",
      "entry": [
        {
          "value": "industrialised",
          "expanded": "Industrialised",
          "description": "Existing vulnerability with detailed attack methods; multiple tools are available for exploitation.",
          "uuid": "7a758b62-7446-58e0-9f48-82a9e5df80b9"
        },
        {
          "value": "customised",
          "expanded": "Customised",
          "description": "Existing vulnerability with a detailed attack approach and one known custom tool available for exploitation.",
          "uuid": "e5cfbe4c-3467-5066-ba32-e705f9b013f7"
        },
        {
          "value": "documented",
          "expanded": "Documented",
          "description": "Existing vulnerability is documented with an attack approach, but tools for exploitation are not available.",
          "uuid": "c03650db-1018-5c03-a559-d21b14d6720e"
        },
        {
          "value": "theoretical",
          "expanded": "Theoretical",
          "description": "Publication describes a theoretical but no actual vulnerability is reported.",
          "uuid": "2113bfbd-08ff-5835-a8f6-fa3f704bb594"
        }
      ]
    },
    {
      "predicate": "information",
      "entry": [
        {
          "value": "PoC",
          "expanded": "Proof-of-Concept",
          "description": "Reference to a proof-of-concept for exploiting the vulnerability.",
          "uuid": "83de9a0b-00c4-5919-b2d4-1aa9e0e64a39"
        },
        {
          "value": "remediation",
          "expanded": "Remediation",
          "description": "Remediation to limit or block the exploitability of the vulnerability.",
          "uuid": "28bf7bb3-3642-5715-9b7d-14eb2f855a13"
        },
        {
          "value": "annotation",
          "expanded": "Annotation",
          "description": "Annotation or clarification to a vulnerability.",
          "uuid": "c7440a31-0e85-545c-a333-be3fa031df48"
        }
      ]
    }
  ],
  "uuid": "bb0e5c42-76ba-595f-99e8-f3bf9c31fc98"
}
