{
  "namespace": "meteorstorm",
  "expanded": "METEORSTORM",
  "description": "MeteorStorm taxonomy for modeling space, cyber, and multi-domain threats and resilience across five layers: Primary Capability Environment (PCE), Segment, Service, Asset, and Analytic.",
  "version": 1,
  "predicates": [
    {
      "value": "PCE-TE",
      "expanded": "Terrestrial Environment",
      "description": "Surface-based operational zones on planetary bodies."
    },
    {
      "value": "PCE-AQ",
      "expanded": "Aquatic Environment",
      "description": "Water-based operational zones, including but not limited to Earth's maritime domains."
    },
    {
      "value": "PCE-AI",
      "expanded": "Air Environment",
      "description": "Atmospheric operational zones spanning low, high, and near-space regions."
    },
    {
      "value": "PCE-OR",
      "expanded": "Orbital Environment",
      "description": "Operational zones within planetary or satellite orbits."
    },
    {
      "value": "PCE-DS",
      "expanded": "Deep Space Environment",
      "description": "Operational zones beyond planetary orbital regimes."
    },

    {
      "value": "SEG-LA",
      "expanded": "Launch Segment",
      "description": "Surface-based services and assets for primary launch operations."
    },
    {
      "value": "SEG-LI",
      "expanded": "Link Segment",
      "description": "Services and assets enabling platform communications across signal paths."
    },
    {
      "value": "SEG-GR",
      "expanded": "Ground Segment",
      "description": "Surface-based services and assets for primary platform operations, serving as the primary locus of control plane activity."
    },
    {
      "value": "SEG-US",
      "expanded": "User Segment",
      "description": "Services and assets for primary end-user operations."
    },
    {
      "value": "SEG-AQ",
      "expanded": "Aquatic Segment",
      "description": "Water-based services and assets for primary platform operations, not limited to Earth's maritime domains."
    },
    {
      "value": "SEG-LO",
      "expanded": "Low Altitude Segment",
      "description": "Aerial services and assets in the lower atmosphere."
    },
    {
      "value": "SEG-HI",
      "expanded": "High Altitude Segment",
      "description": "Aerial services and assets above the lower atmosphere but below near space."
    },
    {
      "value": "SEG-NE",
      "expanded": "Near Space Segment",
      "description": "Aerial services and assets above high altitude and below orbital regions."
    },
    {
      "value": "SEG-SP",
      "expanded": "Space Segment",
      "description": "Services and assets operating in planetary or satellite orbits."
    },
    {
      "value": "SEG-DE",
      "expanded": "Deep Space Segment",
      "description": "Services and assets operating beyond planetary orbital regimes."
    },

    {
      "value": "SVC-CP",
      "expanded": "Control Plane",
      "description": "Services for managing and orchestrating platform control functions."
    },
    {
      "value": "SVC-DP",
      "expanded": "Data Plane",
      "description": "Services for managing and orchestrating mission product functions."
    },
    {
      "value": "SVC-HY",
      "expanded": "Hybrid Service",
      "description": "Services integrating both control and data plane functionalities."
    },

    {
      "value": "AST-HW",
      "expanded": "Hardware Asset",
      "description": "Physical components supporting platform operations."
    },
    {
      "value": "AST-FW",
      "expanded": "Firmware Asset",
      "description": "Embedded control code governing hardware functions."
    },
    {
      "value": "AST-SW",
      "expanded": "Software Asset",
      "description": "Applications and logic executing operational tasks."
    },
    {
      "value": "AST-DA",
      "expanded": "Data Asset",
      "description": "Information generated, processed, or consumed by the platform."
    },
    {
      "value": "AST-SI",
      "expanded": "Signal Asset",
      "description": "Communication channels and transmission frequencies."
    },
    {
      "value": "AST-HY",
      "expanded": "Hybrid Asset",
      "description": "Composite elements combining multiple asset types."
    },

    {
      "value": "AN-AP",
      "expanded": "Attack Path",
      "description": "Known or modeled attack path for a converged space system."
    },
    {
      "value": "AN-IOC",
      "expanded": "Indicator of Compromise",
      "description": "Verifiable indication that the platform has been compromised."
    },
    {
      "value": "AN-IOA",
      "expanded": "Indicator of Attack",
      "description": "Verifiable indication that the platform has been targeted."
    },
    {
      "value": "AN-THR",
      "expanded": "Threat",
      "description": "Known or modeled threat to the platform."
    },
    {
      "value": "AN-DET",
      "expanded": "Detection Signature",
      "description": "Pattern, signal, or logic that triggers on contextualized threat behavior."
    },
    {
      "value": "AN-RES",
      "expanded": "Resilience Measure",
      "description": "Protective capability ensuring resistance or recovery from threats."
    }
  ]
}
